{"schemaVersion":"1.0","id":"m9-frostbound-variation","version":"1.0.0","status":"approved","presets":[{"id":"m9-frostbound-surface-variation","version":"1.0.0","seed":14821,"channels":{"frostCoverage":0.34,"crackDensity":0.17,"scratchDensity":0.12,"highlightScatter":0.22,"particleCount":12,"shardVariance":0.15,"asymmetry":0.08}},{"id":"m9-frostbound-zero-variation","version":"1.0.0","seed":0,"channels":{"frostCoverage":0,"crackDensity":0,"scratchDensity":0,"highlightScatter":0,"particleCount":0,"shardVariance":0,"asymmetry":0}}],"bindings":[{"componentId":"primary-hex-button","region":"content-surface","presetId":"m9-frostbound-surface-variation"},{"componentId":"secondary-hex-button","region":"content-surface","presetId":"m9-frostbound-surface-variation"},{"componentId":"panel","region":"content-surface","presetId":"m9-frostbound-surface-variation"},{"componentId":"panel","region":"focal-surface","presetId":"m9-frostbound-surface-variation"},{"componentId":"tab","region":"content-surface","presetId":"m9-frostbound-surface-variation"},{"componentId":"badge","region":"content-surface","presetId":"m9-frostbound-surface-variation"},{"componentId":"progress","region":"content-surface","presetId":"m9-frostbound-surface-variation"},{"componentId":"icon-container","region":"content-surface","presetId":"m9-frostbound-surface-variation"},{"componentId":"icon-container","region":"focal-surface","presetId":"m9-frostbound-surface-variation"}],"compatibility":{"minimumRendererVersion":"0.1.0","migrationNote":"Every M9 variation output records its resolved seed; zero variation is an explicit supported baseline."}}
