{"schemaVersion":"1.0","id":"m11-enchanted-forest-variation","version":"0.1.0","status":"approved","presets":[{"id":"m11-forest-surface-variation","version":"1.0.0","seed":51731,"channels":{"frostCoverage":0.16,"crackDensity":0.12,"scratchDensity":0.2,"highlightScatter":0.14,"particleCount":0,"shardVariance":0.12,"asymmetry":0.14}},{"id":"m11-forest-zero-variation","version":"1.0.0","seed":0,"channels":{"frostCoverage":0,"crackDensity":0,"scratchDensity":0,"highlightScatter":0,"particleCount":0,"shardVariance":0,"asymmetry":0}}],"bindings":[{"componentId":"primary-hex-button","region":"content-surface","presetId":"m11-forest-surface-variation"},{"componentId":"secondary-hex-button","region":"content-surface","presetId":"m11-forest-surface-variation"},{"componentId":"panel","region":"content-surface","presetId":"m11-forest-surface-variation"},{"componentId":"tab","region":"content-surface","presetId":"m11-forest-surface-variation"},{"componentId":"badge","region":"content-surface","presetId":"m11-forest-surface-variation"},{"componentId":"progress","region":"content-surface","presetId":"m11-forest-surface-variation"},{"componentId":"icon-container","region":"content-surface","presetId":"m11-forest-surface-variation"}],"compatibility":{"minimumRendererVersion":"0.1.0","migrationNote":"Variation changes only material/ornament masks."}}
