{"schemaVersion":"1.0","id":"m10-volcanic-forge-variation","version":"0.1.0","status":"approved","presets":[{"id":"m10-volcanic-surface-variation","version":"1.0.0","seed":39211,"channels":{"frostCoverage":0.18,"crackDensity":0.28,"scratchDensity":0.22,"highlightScatter":0.12,"particleCount":0,"shardVariance":0.18,"asymmetry":0.16}},{"id":"m10-volcanic-zero-variation","version":"1.0.0","seed":0,"channels":{"frostCoverage":0,"crackDensity":0,"scratchDensity":0,"highlightScatter":0,"particleCount":0,"shardVariance":0,"asymmetry":0}}],"bindings":[{"componentId":"primary-hex-button","region":"content-surface","presetId":"m10-volcanic-surface-variation"},{"componentId":"secondary-hex-button","region":"content-surface","presetId":"m10-volcanic-surface-variation"},{"componentId":"panel","region":"content-surface","presetId":"m10-volcanic-surface-variation"},{"componentId":"panel","region":"focal-surface","presetId":"m10-volcanic-surface-variation"},{"componentId":"tab","region":"content-surface","presetId":"m10-volcanic-surface-variation"},{"componentId":"badge","region":"content-surface","presetId":"m10-volcanic-surface-variation"},{"componentId":"progress","region":"content-surface","presetId":"m10-volcanic-surface-variation"},{"componentId":"icon-container","region":"content-surface","presetId":"m10-volcanic-surface-variation"},{"componentId":"icon-container","region":"focal-surface","presetId":"m10-volcanic-surface-variation"}],"compatibility":{"minimumRendererVersion":"0.1.0","migrationNote":"No component emits particles; portrait-only ember budget is handled by the M10 focal binding."}}
